{
  "schema_version": "x07.web_ui.profile@0.1.0",
  "id": "web_ui_debug",
  "v": 1,
  "wasm_profile_id": "wasm_web_ui_debug",
  "defaults": {
    "arena_cap_bytes": 8388608,
    "max_input_bytes": 65536,
    "max_output_bytes": 1048576,
    "serve": {
      "port": 0,
      "strict_mime": true
    },
    "build": {
      "format": "core",
      "emit_host_assets": true
    }
  }
}
